id_str,created_at,place,source,text,coordinates,geo,is_quote_status,retweet_count,quote_count,reply_count,user_created_at,user_description,user_followers_count,user_following,user_friends_count,user_id_str,user_location,user_name,user_statuses_count
834730858066149376,Thu Feb 23 11:45:19 +0000 2017,,"<a href=""http://twitter.com/download/android"" rel=""nofollow"">Twitter for Android</a>",So I was unware you could invest in Kingston wharves.,,,False,0,1,0,Wed Nov 11 03:27:15 +0000 2009,🇯🇲🌴 Student of Life | Lover of Music & the Performing Arts | Track & Field Enthusiast | CIPPE. | IG:@arjintum,1195,,579,89096547,United Kingdom,OrionPixie ☀️,151796
830097835802689538,Fri Feb 10 16:55:21 +0000 2017,,"<a href=""http://twitter.com/download/android"" rel=""nofollow"">Twitter for Android</a>",Had a much more pleasant experience at @jacustoms . Kudos to the professional and pleasant people working for Kingston Wharves,,,False,0,0,0,Wed Jul 01 01:46:51 +0000 2009,,139,,629,52594606,"Kingston, Jamaica",Mickelle Hughes,529
828571942148067328,Mon Feb 06 11:51:59 +0000 2017,,"<a href=""http://app.stockboard.com/"" rel=""nofollow"">Stockboard</a>",$KW Kennedy Wilson and Partner Acquire Multifamily Community in Seattle for $141M... - https://t.co/GQRAooDfk8,,,False,0,0,0,Thu Feb 04 10:18:01 +0000 2016,,489,,39,4858453045,"Vancouver, British Columbia",Stockboard Media Inc,111441
827577438892912640,Fri Feb 03 18:00:11 +0000 2017,,"<a href=""http://www.facebook.com/twitter"" rel=""nofollow"">Facebook</a>","Check out this t-shirt design we did for KINGSTON WHARVES. Get all your graphic designs DONE NOW. ONLY $1,500JMD... https://t.co/QEiMRZJ1XQ",,,False,0,0,0,Sat Oct 19 16:38:56 +0000 2013,"Only $1,500JMD / $20USD for all graphic designs. Video editing services also available. Visit http://www.dizinejamaica.com & REGISTER FREE!",291,,3,1972152008,Jamaica,Dizine Jamaica,859
826819927260676096,Wed Feb 01 15:50:06 +0000 2017,,"<a href=""https://buffer.com"" rel=""nofollow"">Buffer</a>",Kingston Wharves welcomes largest autoliner https://t.co/LrO1mKpMva #jamaica #shipping #port #progress,,,False,0,0,0,Fri Apr 22 13:21:25 +0000 2016,"JamaicaPCS will foster integration and
transparency, which will give
members of the port community access to information in real time.",41,,106,723501967641735168,Jamaica,Jamaica PCS,494
826434061791031296,Tue Jan 31 14:16:49 +0000 2017,,"<a href=""http://twitter.com/download/iphone"" rel=""nofollow"">Twitter for iPhone</a>",New #autoliner at #KingstonWharves via @JamaicaObserver 👉🏽https://t.co/csm7aunvWu #shipping #logistics #jamaica https://t.co/CgsiqcZiEB,,,False,0,0,0,Sat Apr 04 16:37:47 +0000 2015,MD. Inventor. Unconventional work style. No time for inauthenticity. Purpose. #Entrepreneur #WorkplaceWellness #Vaccines #StopFlu Appt:876-338-8897 ☎️,1977,,1659,3134349215,"11 Cunningham Ave, KGN 6, JAM",MinistryOfTourismHealth&Wellness(MoTHaW),28060
826431541735727104,Tue Jan 31 14:06:48 +0000 2017,,"<a href=""http://blackberry.com/twitter"" rel=""nofollow"">Twitter for BlackBerry®</a>",#JAM #Shipping - Kingston Wharves welcomes largest autoliner | @JamaicaGleaner https://t.co/W1lOsf39d0,,,False,2,0,0,Thu Aug 26 13:36:11 +0000 2010,"Official Twitter account of #PHC, DIGITAL Division (a @PH_AECo division): #ICT, #AEC consultants to #Caribbean construction & design professionals.",3910,,4031,183230503,"Kingston, Jamaica","#PHC, DIGITAL Division",194161
826401675342655489,Tue Jan 31 12:08:07 +0000 2017,,"<a href=""http://www.facebook.com/twitter"" rel=""nofollow"">Facebook</a>",Kingston Wharves welcomes largest autoliner https://t.co/bRyXyLY1IW,,,False,1,0,0,Wed May 08 18:36:54 +0000 2013,Leveraging the Power of Speed and Connectivity. A government-backed initiative to establish Jamaica as a global logistics node within the Americas.,1059,,801,1413560323,Jamaica,Jalogisticshub,4371
826330504593027072,Tue Jan 31 07:25:19 +0000 2017,,"<a href=""https://ifttt.com"" rel=""nofollow"">IFTTT</a>",JAMAICA: Kingston Wharves welcomes largest autoliner https://t.co/iBeM4hJV95 entornoi https://t.co/9GzXk7o2VP,,,False,0,0,0,Fri Jan 25 23:09:48 +0000 2013,"Periodista
Amante de las novelas románticas
Imparcial
Creadora de la página: https://www.facebook.com/Faery-Un-Mundo-de-Ilusión-161231354308245/",825,,1982,1120459002,"Caracas, Venezuela",Yolimar Scarpita,1092035
826205400705953794,Mon Jan 30 23:08:12 +0000 2017,"{'attributes': {}, 'bounding_box': {'coordinates': [[[-78.368878, 17.705786], [-78.368878, 18.525029], [-76.183028, 18.525029], [-76.183028, 17.705786]]], 'type': 'Polygon'}, 'country': 'Jamaica', 'country_code': 'JM', 'full_name': 'Jamaica', 'id': 'd66ca907ceb62690', 'name': 'Jamaica', 'place_type': 'country', 'url': 'https://api.twitter.com/1.1/geo/id/d66ca907ceb62690.json'}","<a href=""http://foursquare.com"" rel=""nofollow"">Foursquare</a>","I'm at Kingston Wharves in Kingston, St Andrew Parish https://t.co/QG7m0l5umn","{'coordinates': [-76.82775908, 17.98467463], 'type': 'Point'}","{'coordinates': [17.98467463, -76.82775908], 'type': 'Point'}",False,0,0,0,Fri Jul 23 22:30:32 +0000 2010,Hardcore Techie who loves to socialize and meet new people,293,,627,170086664,"17.986749,-76.835328",Ricardo Barrett,1472
824585295836418052,Thu Jan 26 11:50:29 +0000 2017,,"<a href=""http://app.stockboard.com/"" rel=""nofollow"">Stockboard</a>",$KW Kennedy Wilson to Announce Fourth Quarter and FY 2016 Earnings... - https://t.co/HI6ns13yEg,,,False,0,0,0,Thu Feb 04 10:18:01 +0000 2016,,489,,39,4858453045,"Vancouver, British Columbia",Stockboard Media Inc,111441
820282539923349504,Sat Jan 14 14:52:52 +0000 2017,,"<a href=""http://www.facebook.com/twitter"" rel=""nofollow"">Facebook</a>","For $ALE at Port Bustamante, Kingston Wharves, Jamaica, West Indies @ JA$1.4M",,,False,0,0,0,Mon Apr 04 07:59:37 +0000 2011,"CEO,Customline Auto Brokers http://customlineauto.com/paulrhoden Founder/Mng. Director, World Of Reggae Music http://reggaemusic.storenvy.com Musical Ambassador",2044,,1209,276875538,"Jamaica, West Indies",Paul Rhoden,14404
817177552565522432,Fri Jan 06 01:14:45 +0000 2017,"{'attributes': {}, 'bounding_box': {'coordinates': [[[-78.368878, 17.705786], [-78.368878, 18.525029], [-76.183028, 18.525029], [-76.183028, 17.705786]]], 'type': 'Polygon'}, 'country': 'Jamaica', 'country_code': 'JM', 'full_name': 'Jamaica', 'id': 'd66ca907ceb62690', 'name': 'Jamaica', 'place_type': 'country', 'url': 'https://api.twitter.com/1.1/geo/id/d66ca907ceb62690.json'}","<a href=""http://foursquare.com"" rel=""nofollow"">Foursquare</a>","Toot! ⛴ (@ Kingston Wharves in Kingston, St Andrew Parish) https://t.co/5HaVMQFEJW","{'coordinates': [-76.82775908, 17.98467463], 'type': 'Point'}","{'coordinates': [17.98467463, -76.82775908], 'type': 'Point'}",False,0,0,0,Thu Apr 14 04:35:50 +0000 2011,🌴❤🌎 • Caribbean Love • Sustainable Tropical Living • Save Water • Build Green • Drive Electric • Buy Local (Art) • Pray Divine Mercy • Live in Hope •♀️,5838,,2214,281880594,Jamaica ♡ 🇯🇲🇹🇹🇵🇭,Mx.,26620
813779579596865536,Tue Dec 27 16:12:25 +0000 2016,,"<a href=""http://twitter.com/download/iphone"" rel=""nofollow"">Twitter for iPhone</a>",@TerriKarelle was it you I saw recently at Kingston wharves ?,,,False,0,1,0,Tue May 22 03:58:43 +0000 2012,"@sochillclothing local brand 👕👖👙  
  ⚽-#Gunners
  🏀-#Lakers
 💸- #BrokerClerk",206,,578,587124547,Jah-mek-yah / island life ,Jazzy SoChi🌴🌴,14764
813225097750282240,Mon Dec 26 03:29:06 +0000 2016,,"<a href=""http://www.facebook.com/twitter"" rel=""nofollow"">Facebook</a>","Kingston Wharves Invests In Crane Operators, Mechanics #Education.... https://t.co/2lTYGBzRaC",,,False,2,0,0,Sun Feb 15 00:25:15 +0000 2015,"Largest private scholarship organization in the Caribbean, we’re all about students. We're a scholarship resource, advocate & driving force for Edu Financing.",3217,,1023,3038029372,"Kingston, Jamaica",Scholarship Jamaica,30050
813138022170587136,Sun Dec 25 21:43:06 +0000 2016,,"<a href=""http://twitter.com/download/iphone"" rel=""nofollow"">Twitter for iPhone</a>","Kingston Wharves invests in crane operators, mechanics education https://t.co/PdbHw8YPNg",,,False,0,0,0,Sat May 29 02:03:01 +0000 2010,FSO/ Retweets only indicate that I'm intrigued and are not endorsements,421,,651,149345432,,Andrew Francis,15069
812902587728920576,Sun Dec 25 06:07:34 +0000 2016,,"<a href=""https://dlvrit.com/"" rel=""nofollow"">dlvr.it</a>","Kingston Wharves invests in crane operators, mechanics education https://t.co/EkfJHbvB8f",,,False,0,0,0,Tue May 22 19:48:48 +0000 2012,CBC is committed to providing its members with opportunities and resources to create stronger alliances that will result in increased profits.,122,,21,587699183,New York,CBC,25437
812364780291952640,Fri Dec 23 18:30:31 +0000 2016,,"<a href=""http://www.facebook.com/twitter"" rel=""nofollow"">Facebook</a>","▬▬▬▬▬☆JIS☆▬▬▬▬▬
JIS_Kingston Wharves_
Totally Logistics Center 
▬▬▬▬▬☆JIS☆▬▬▬▬▬... https://t.co/KEwTtU1kFy",,,False,0,0,0,Tue May 26 18:56:59 +0000 2009,Social Media Management and Digital Marketing ★Develop and implement content ★Coordinate online promotions ★Announce community events,59,,180,42691250,,"Lion Pomotions, Inc.",4067
811997216537792513,Thu Dec 22 18:09:57 +0000 2016,,"<a href=""http://publicize.wp.com/"" rel=""nofollow"">WordPress.com</a>",Ganja seized at Kingston Wharves https://t.co/cb11gvVtwR https://t.co/Vt10rL32Du,,,False,0,0,0,Fri Feb 21 04:06:40 +0000 2014,The Caribbean's Hottest Television Station,983,,1770,2355797043,Jamaica,BOJTV,38426
811946254284521472,Thu Dec 22 14:47:26 +0000 2016,,"<a href=""http://jamaica-gleaner.com"" rel=""nofollow"">GleanerViaDrupal</a>",44 pounds of ganja seized at Kingston Wharves - https://t.co/cPmtDyGL2i,,,False,3,1,1,Mon May 18 20:04:59 +0000 2009,"Jamaica's most trusted news source for 186 years. Where life unfolds. Follow for news, sports, business, lifestyle, entertainment and commentary.",305590,,602,40954616,Jamaica,Jamaica Gleaner,162209
811316238043508736,Tue Dec 20 21:03:59 +0000 2016,,"<a href=""http://twitter.com/download/android"" rel=""nofollow"">Twitter for Android</a>",Kingston Wharves is hiring a lot people. Get on that,,,False,0,0,0,Fri Apr 17 14:52:18 +0000 2009,I love music!,169,,168,32433556,"St. Andrew, JM",sam's husband (au jus) 🏁,7248
811177037524271105,Tue Dec 20 11:50:51 +0000 2016,,"<a href=""http://app.stockboard.com/"" rel=""nofollow"">Stockboard</a>",$KW Kennedy Wilson and Takenaka Corporation Acquire San Francisco Landmark Bank Branch and Office Tower ... - https://t.co/GlTPGfPfok,,,False,0,0,0,Thu Feb 04 10:18:01 +0000 2016,,489,,39,4858453045,"Vancouver, British Columbia",Stockboard Media Inc,111441
808727461487923200,Tue Dec 13 17:37:06 +0000 2016,,"<a href=""https://buffer.com"" rel=""nofollow"">Buffer</a>",Kingston Wharves at the centre of cruise history https://t.co/43mOVSJyVT #jamaica #cruise #logistics #tourism #news @jalogisticshub,,,False,0,0,0,Fri Apr 22 13:21:25 +0000 2016,"JamaicaPCS will foster integration and
transparency, which will give
members of the port community access to information in real time.",41,,106,723501967641735168,Jamaica,Jamaica PCS,494
808683339330813952,Tue Dec 13 14:41:47 +0000 2016,,"<a href=""http://www.facebook.com/twitter"" rel=""nofollow"">Facebook</a>",Kingston Wharves at the centre of cruise history https://t.co/bo9K1AI3zT,,,False,1,0,0,Wed May 08 18:36:54 +0000 2013,Leveraging the Power of Speed and Connectivity. A government-backed initiative to establish Jamaica as a global logistics node within the Americas.,1059,,801,1413560323,Jamaica,Jalogisticshub,4371
808651163532984322,Tue Dec 13 12:33:56 +0000 2016,,"<a href=""http://blackberry.com/twitter"" rel=""nofollow"">Twitter for BlackBerry®</a>",#JAM - Kingston Wharves at the centre of #cruise history | @JamaicaGleaner https://t.co/SnYJB5qCYX,,,False,6,0,0,Thu May 07 14:23:04 +0000 2009,"Official account of Paul Hay, #PHC Projects (@PH_AECo) founder. I tweet on #Politics, #Economy, #Society & #Technology in Jamaica & the Cayman Islands. #JM  #KY",3660,,3552,38439288,"Kingston, Jamaica",Paul A. Hay,227687
808556936346140672,Tue Dec 13 06:19:30 +0000 2016,,"<a href=""https://ifttt.com"" rel=""nofollow"">IFTTT</a>",jamaica: Kingston Wharves at the centre of cruise history https://t.co/jsQ6gJ6c1H,,,False,0,0,0,Sun Apr 12 03:11:43 +0000 2015,"Relax In Jamaica. Enjoy the Amazing Beaches, Sights and Attractions. We're here 2 RT your tweets. Follow me & we follow back.",1602,,872,3158250305,Jamaica,Relax In Jamaica,85279
808552446419210240,Tue Dec 13 06:01:40 +0000 2016,,"<a href=""https://ifttt.com"" rel=""nofollow"">IFTTT</a>",jamaica: Kingston Wharves at the centre of cruise history https://t.co/W1LIdtbKha,,,False,0,0,0,Sat Feb 02 14:21:15 +0000 2013,"The place to find your Hot Beach Spot
Destinations!!!",3037,,3159,1142563184,Miami,HotBeachSpots.com,105992
808552315154092032,Tue Dec 13 06:01:08 +0000 2016,,"<a href=""https://dlvrit.com/"" rel=""nofollow"">dlvr.it</a>",Kingston Wharves at the centre of cruise history https://t.co/YgduKsFCwX,,,False,1,2,0,Fri Apr 04 15:25:29 +0000 2008,The latest Jamaican news and updates. 🇯🇲,66720,,355,14303545,Jamaica,jamaica,119033
808508427618189312,Tue Dec 13 03:06:45 +0000 2016,,"<a href=""http://twitter.com/download/android"" rel=""nofollow"">Twitter for Android</a>",@SCCCJA @jacustoms #kingston wharves https://t.co/Ylbdl0zXVY,,,True,0,0,0,Tue May 05 00:46:35 +0000 2015,Sunshine City Chamber of Commerce is focused on the economic and social development of the Portmore Community. Jamaica Chamber of Commerce Affiliate.,188,,99,3185664000,"Portmore, St. Catherine",SCCC Jamaica,1673
808442016958844928,Mon Dec 12 22:42:51 +0000 2016,,"<a href=""https://proudjamaica.com"" rel=""nofollow"">PROUD JAMAICA</a>",Kingston Wharves Forfeits Unclaimed Pre-2004 Dividends - https://t.co/HsWRyQerfH https://t.co/cZGakPSRFQ,,,False,0,0,0,Tue Sep 01 23:31:15 +0000 2015,PROUDLY HIGHLIGHTING JAMAICA'S MANY ACHIEVEMENTS,1684,,1103,3517353735,Jamaica,PROUD JAMAICA,29231
808442012135526400,Mon Dec 12 22:42:50 +0000 2016,,"<a href=""http://www.facebook.com/twitter"" rel=""nofollow"">Facebook</a>",Kingston Wharves Forfeits Unclaimed Pre-2004 Dividends https://t.co/4qMBDhQJfW,,,False,0,0,0,Wed Oct 05 03:19:03 +0000 2011,"█▀░█▀█░█░░░█░░░█▀█░█░█░█░░░░█▀█▀█░█▀ █▀░█░█░█░░░█░░░█░█░█░█░█░▀▀░█░█░█░█▀ ▀░░▀▀▀░▀▀▀░▀▀▀░▀▀▀░▀▀░▀▀░░░
Watch Movies,TV Shows, Music Videos, Live TV",393,,1640,385226650,,WatchAnything.info,19514
808316930411073538,Mon Dec 12 14:25:48 +0000 2016,,"<a href=""http://www.facebook.com/twitter"" rel=""nofollow"">Facebook</a>",JIS_Kingston Wharves_Total Logistics Centre https://t.co/uE1CA7X7Ri,,,False,0,0,0,Fri Feb 21 16:23:26 +0000 2014,Factories Corporation of Jamaica Limited is a government agency with responsibilities for the development and management of industrial and commercial space.,222,,190,2355033998,17 Knutsford Boulevard,Factories Corporation of Jamaica Limited - FCJ,1488
807922802615525376,Sun Dec 11 12:19:41 +0000 2016,,"<a href=""http://www.facebook.com/twitter"" rel=""nofollow"">Facebook</a>",JIS_Kingston Wharves_Total Logistics Centre https://t.co/X8qyxXv28s,,,False,0,1,0,Wed May 08 18:36:54 +0000 2013,Leveraging the Power of Speed and Connectivity. A government-backed initiative to establish Jamaica as a global logistics node within the Americas.,1059,,801,1413560323,Jamaica,Jalogisticshub,4371
806320978888458242,Wed Dec 07 02:14:36 +0000 2016,,"<a href=""http://twitter.com"" rel=""nofollow"">Twitter Web Client</a>",This Morning the MS Monarch Docked at Berth 2 Kingston Wharves. https://t.co/dkePYrlfX6,,,True,0,1,0,Sat Dec 27 02:41:27 +0000 2008,Man of the world.,468,,244,18400596,"Kingston, Jamaica ",Amun-Ra,30011
806195248904945664,Tue Dec 06 17:55:00 +0000 2016,,"<a href=""http://twitter.com/download/android"" rel=""nofollow"">Twitter for Android</a>",@MOFPJA Monarch of the seas docks at Kingston Wharves' Berth II with over 2700 passengers on board. Welcome to JA! https://t.co/FGd8VDRS7m,,,False,2,0,0,Mon Feb 14 15:46:28 +0000 2011,The Jamaica Customs Agency,6948,,184,252143179,"Newport East, Jamaica",Jamaica Customs,840
806193946313498624,Tue Dec 06 17:49:49 +0000 2016,,"<a href=""http://twitter.com/download/android"" rel=""nofollow"">Twitter for Android</a>","JCA staff ready to assist passengers  on Monarch of the Seas which docked at Kingston Wharves' Berth II, Dec 6, 2016 https://t.co/nkFxgTHnH0",,,False,5,0,0,Mon Feb 14 15:46:28 +0000 2011,The Jamaica Customs Agency,6948,,184,252143179,"Newport East, Jamaica",Jamaica Customs,840
806104353165770752,Tue Dec 06 11:53:49 +0000 2016,,"<a href=""http://twitter.com/download/android"" rel=""nofollow"">Twitter for Android</a>",Berth 2 of Kingston Wharves has been transformed to welcome The Pullman turn Monarch https://t.co/io6ZDvJi05,,,False,0,0,0,Sat Dec 27 02:41:27 +0000 2008,Man of the world.,468,,244,18400596,"Kingston, Jamaica ",Amun-Ra,30011
804684154701017088,Fri Dec 02 13:50:27 +0000 2016,,"<a href=""https://postcron.com"" rel=""nofollow"">Postcron App</a>",Altman Z-Score Analysis for Kingston Wharves Limited (KW) #altmanzscore https://t.co/qwiMIHk455 https://t.co/bMP2ECRwMD,,,False,0,0,0,Wed Aug 31 18:27:39 +0000 2011,"Altman Z-Score + Android, BlackBerry, iOS and Web Application developed in collaboration with Prof. Edward Altman analyzes corporate credit risk objectively.",97,,118,365605154,New Jersey,Altman Z-Score+,19427
804684151697903616,Fri Dec 02 13:50:26 +0000 2016,,"<a href=""https://postcron.com"" rel=""nofollow"">Postcron App</a>",Altman Z-Score Analysis for Kingston Wharves Limited (KW) #altmanzscore https://t.co/BJL7Sb3Rf8 https://t.co/MTbIZLWuhb,,,False,0,0,0,Sun Apr 08 20:37:58 +0000 2012,MBA Sidekick is a comprehensive application for MBA Students and Professionals. This is the go-to app for MBAs.,25,,1,548784663,"Randolph, NJ",MBA Sidekick,15439
804684138234216452,Fri Dec 02 13:50:23 +0000 2016,,"<a href=""https://postcron.com"" rel=""nofollow"">Postcron App</a>",Altman Z-Score Analysis for Kingston Wharves Limited (KW) #altmanzscore https://t.co/3LZIG44GFN https://t.co/X8jHnxpLkS,,,False,0,0,0,Wed Apr 11 18:23:49 +0000 2012,Comprehensive Financial Applications for MBAs,51,,4,551292729,"Randolph, NJ",The Finance MBA,15437
804655211725881344,Fri Dec 02 11:55:26 +0000 2016,,"<a href=""http://app.stockboard.com/"" rel=""nofollow"">Stockboard</a>",$KW Kennedy Wilson Closes $363M of Multifamily Transactions... - https://t.co/JFvvFsX3at,,,False,0,0,0,Thu Feb 04 10:18:01 +0000 2016,,489,,39,4858453045,"Vancouver, British Columbia",Stockboard Media Inc,111441
804654271316819969,Fri Dec 02 11:51:42 +0000 2016,,"<a href=""http://app.stockboard.com/"" rel=""nofollow"">Stockboard</a>",$KW Kennedy Wilson Announces Dividend of $0.14 Per Common Share for Fourth Quarter 2016... - https://t.co/gWPwPgaQct,,,False,0,0,0,Thu Feb 04 10:18:01 +0000 2016,,489,,39,4858453045,"Vancouver, British Columbia",Stockboard Media Inc,111441
803252129569927169,Mon Nov 28 15:00:06 +0000 2016,,"<a href=""http://www.facebook.com/twitter"" rel=""nofollow"">Facebook</a>",The Caribbean Shipping Association is providing members with a chance to participate in a study tour showcasing... https://t.co/KneBpoKGuT,,,False,0,0,0,Wed Feb 17 18:41:39 +0000 2010,"A tech-savvy logistics & ocean transport company for trade between the Eastern Caribbean, U. S. and Africa.",303,,1245,115136999,,PremierCaribe Shipping and Logistics,1331
799616981100101632,Fri Nov 18 14:15:19 +0000 2016,,"<a href=""http://twitter.com"" rel=""nofollow"">Twitter Web Client</a>",https://t.co/iIKRQStxML,,,False,0,0,0,Tue Jun 16 23:48:40 +0000 2009,"https://t.co/HAMJ8YwPer @ Twitter for The Latest In Caribbean & International SME Business News, Empowering Leaders and Entrepreneurs. Follow, Stay Current",534,,101,47779740,Silicon Mountain Mandeville Ja,Businessuiteonline.com,5939
799486956480643072,Fri Nov 18 05:38:38 +0000 2016,,"<a href=""https://dlvrit.com/"" rel=""nofollow"">dlvr.it</a>",Kingston Wharves to navigate uncertain trade prospects in final quarter https://t.co/RNwrPIsksH,,,False,0,0,0,Tue May 22 19:48:48 +0000 2012,CBC is committed to providing its members with opportunities and resources to create stronger alliances that will result in increased profits.,122,,21,587699183,New York,CBC,25437
799045645067833344,Thu Nov 17 00:25:01 +0000 2016,,"<a href=""http://www.linkedin.com/"" rel=""nofollow"">LinkedIn</a>","Hall wary of trade changes, but Kingston Wharves prepares for expansion - Business https://t.co/43NSEIEsl9",,,False,0,0,0,Wed May 08 20:34:01 +0000 2013,Special Economic Zone Specialist | Logistics and Global Value Chains Enthusiast | Educator | Blogger | Lawyer| Rotarian| Data Viz Student| Rugby Player,271,,936,1413757236,Jamaica,Ainsley Brown,8054
798982887659827201,Wed Nov 16 20:15:39 +0000 2016,,"<a href=""http://twitter.com"" rel=""nofollow"">Twitter Web Client</a>",https://t.co/LKvaD1ogZo,,,False,0,0,0,Tue Jun 16 23:48:40 +0000 2009,"https://t.co/HAMJ8YwPer @ Twitter for The Latest In Caribbean & International SME Business News, Empowering Leaders and Entrepreneurs. Follow, Stay Current",534,,101,47779740,Silicon Mountain Mandeville Ja,Businessuiteonline.com,5939
798980307731021826,Wed Nov 16 20:05:24 +0000 2016,,"<a href=""https://ifttt.com"" rel=""nofollow"">IFTTT</a>","JamaicaObserver: Hall wary of trade changes, but Kingston Wharves prepares for expansion https://t.co/h34b9o2yDE https://t.co/quBbL0XZGT",,,False,0,0,0,Tue Oct 28 18:58:47 +0000 2014,SEE US ON YOUTUBE https://t.co/grxAaPNxue TONY JONES business man and owner of local garden services professional garden OUR WEBSITE AT https://t.co/M1Z2NdmBX7,1582,,2012,2848641431,manchester,david hill,22678
798978959069220864,Wed Nov 16 20:00:02 +0000 2016,,"<a href=""https://about.twitter.com/products/tweetdeck"" rel=""nofollow"">TweetDeck</a>","Hall wary of trade changes, but Kingston Wharves prepares for expansion https://t.co/89ZKusQSIq https://t.co/b326WsLH2M",,,False,0,0,0,Tue Apr 22 04:40:35 +0000 2008,Jamaica's Number 1 Daily Newspaper: Every Day Matters,260473,,312,14470793,"Kingston, Jamaica",Jamaica Observer,203120
796375747728437249,Wed Nov 09 15:35:48 +0000 2016,,"<a href=""http://www.facebook.com/twitter"" rel=""nofollow"">Facebook</a>",Kingston Wharves' big plans ... Making Customs clearance easier https://t.co/Ka8haxWo2d,,,False,0,0,0,Fri Feb 21 16:23:26 +0000 2014,Factories Corporation of Jamaica Limited is a government agency with responsibilities for the development and management of industrial and commercial space.,222,,190,2355033998,17 Knutsford Boulevard,Factories Corporation of Jamaica Limited - FCJ,1488
796133787855941633,Tue Nov 08 23:34:21 +0000 2016,,"<a href=""http://blackberry.com/twitter"" rel=""nofollow"">Twitter for BlackBerry®</a>",#JAM - Kingston Wharves' big plans ... Making #Customs clearance easier | @JamaicaGleaner https://t.co/3jFDK8xz5q,,,False,2,0,0,Thu May 07 14:23:04 +0000 2009,"Official account of Paul Hay, #PHC Projects (@PH_AECo) founder. I tweet on #Politics, #Economy, #Society & #Technology in Jamaica & the Cayman Islands. #JM  #KY",3660,,3552,38439288,"Kingston, Jamaica",Paul A. Hay,227687
795968521570238465,Tue Nov 08 12:37:38 +0000 2016,,"<a href=""http://www.linkedin.com/"" rel=""nofollow"">LinkedIn</a>",Kingston Wharves' big plans ... Making Customs clearance easier https://t.co/zcgscCz81h,,,False,0,0,0,Wed May 08 20:34:01 +0000 2013,Special Economic Zone Specialist | Logistics and Global Value Chains Enthusiast | Educator | Blogger | Lawyer| Rotarian| Data Viz Student| Rugby Player,271,,936,1413757236,Jamaica,Ainsley Brown,8054
795968449746993152,Tue Nov 08 12:37:21 +0000 2016,,"<a href=""http://www.facebook.com/twitter"" rel=""nofollow"">Facebook</a>",Kingston Wharves' big plans ... Making Customs clearance easier https://t.co/vydffGg8BC,,,False,0,0,0,Wed May 08 18:36:54 +0000 2013,Leveraging the Power of Speed and Connectivity. A government-backed initiative to establish Jamaica as a global logistics node within the Americas.,1059,,801,1413560323,Jamaica,Jalogisticshub,4371
794273511137083392,Thu Nov 03 20:22:16 +0000 2016,,"<a href=""http://app.stockboard.com/"" rel=""nofollow"">Stockboard</a>",$KW Kennedy Wilson Reports Third Quarter 2016 Results... - https://t.co/i82c05pXdr,,,False,0,0,0,Thu Feb 04 10:18:01 +0000 2016,,489,,39,4858453045,"Vancouver, British Columbia",Stockboard Media Inc,111441
791701715783389184,Thu Oct 27 18:02:52 +0000 2016,,"<a href=""http://www.facebook.com/twitter"" rel=""nofollow"">Facebook</a>",Kingston Wharves wins CSA Port of the Year Award! https://t.co/5jJkIZzqEv,,,False,1,0,0,Wed May 08 18:36:54 +0000 2013,Leveraging the Power of Speed and Connectivity. A government-backed initiative to establish Jamaica as a global logistics node within the Americas.,1059,,801,1413560323,Jamaica,Jalogisticshub,4371
791266733776523264,Wed Oct 26 13:14:25 +0000 2016,"{'attributes': {}, 'bounding_box': {'coordinates': [[[-78.368878, 17.705786], [-78.368878, 18.525029], [-76.183028, 18.525029], [-76.183028, 17.705786]]], 'type': 'Polygon'}, 'country': 'Jamaica', 'country_code': 'JM', 'full_name': 'Jamaica', 'id': 'd66ca907ceb62690', 'name': 'Jamaica', 'place_type': 'country', 'url': 'https://api.twitter.com/1.1/geo/id/d66ca907ceb62690.json'}","<a href=""http://twitter.com/download/android"" rel=""nofollow"">Twitter for Android</a>",Kingston Wharves named best multi-purpose port in Caribbean https://t.co/gESSac2lWl,,,False,0,0,0,Sat Dec 27 02:41:27 +0000 2008,Man of the world.,468,,244,18400596,"Kingston, Jamaica ",Amun-Ra,30011
