id_str,created_at,place,source,text,coordinates,geo,is_quote_status,retweet_count,quote_count,reply_count,user_created_at,user_description,user_followers_count,user_following,user_friends_count,user_id_str,user_location,user_name,user_statuses_count
1132037796124856326,Fri May 24 21:36:57 +0000 2019,,"<a href=""http://twitter.com/download/iphone"" rel=""nofollow"">Twitter for iPhone</a>",Update marcus garvey drive 4 30 pm. Heading to downtown is free flowing. Coming from downtown towards portmore. Tra… https://t.co/M0nyIAYF6j,,,False,8,0,0,Thu May 20 20:16:11 +0000 2010,bed,979,,838,146184496,,Lay Z,40583
1129280388101169153,Fri May 17 07:00:00 +0000 2019,,"<a href=""https://about.twitter.com/products/tweetdeck"" rel=""nofollow"">TweetDeck</a>","Kingston Wharves continue winning run in domino league
https://t.co/lf1YNm5ZhW https://t.co/m7Ys4mciku",,,False,0,0,0,Tue Apr 22 04:40:35 +0000 2008,Jamaica's Number 1 Daily Newspaper: Every Day Matters,260473,,312,14470793,"Kingston, Jamaica",Jamaica Observer,203120
1127314130493480965,Sat May 11 20:46:47 +0000 2019,,"<a href=""https://mobile.twitter.com"" rel=""nofollow"">Twitter Web App</a>","@MS50493387 @LudwigCromwell @IstInteressiert @BVagelman @ZDF @welt 13
Und neuere Experimente sind nicht besser.

So… https://t.co/AIc4cP0P0W",,,False,0,0,1,Thu Jan 05 16:01:07 +0000 2017,"Father of two daughters and two sons aged 5 to 17 | 
Viel schönes dabei. | Hier wurden schon Fischotter, Dachse und Hermeline gestreichelt",558,,320,817038223708975104,Germany,Traummann Fidibus ヽ(°◇° )ノ,35778
1126952892106256384,Fri May 10 20:51:21 +0000 2019,,"<a href=""http://twitter.com"" rel=""nofollow"">Twitter Web Client</a>","From The Archives: The Daily Gleaner, May 10, 1967
Kingston Wharves plans subsidiary company https://t.co/OUz7PbKSvo",,,False,1,0,0,Tue Dec 29 12:44:28 +0000 2015,"Jamaica's record keeper. Inside the 185-year-old archives of @jamaicagleaner, the oldest operating newspaper in the Caribbean. 
876-932-6231",2384,,242,4643160922,Jamaica,GLNR Archives,4889
1124359916498706432,Fri May 03 17:07:48 +0000 2019,,"<a href=""https://proudjamaica.com"" rel=""nofollow"">PROUD JAMAICA</a>",Kingston Wharves Reports $7B in Revenues for 2018 - https://t.co/1nYqNmNgzb https://t.co/ci8K3tiqDY,,,False,0,0,0,Tue Sep 01 23:31:15 +0000 2015,PROUDLY HIGHLIGHTING JAMAICA'S MANY ACHIEVEMENTS,1684,,1103,3517353735,Jamaica,PROUD JAMAICA,29231
1124357026476384257,Fri May 03 16:56:19 +0000 2019,,"<a href=""http://twitter.com"" rel=""nofollow"">Twitter Web Client</a>",Kingston Wharves Reports $7B in Revenues for 2018 - https://t.co/j6Uqxn6nt9,,,False,2,0,0,Mon Feb 08 19:44:38 +0000 2010,"Jamaican news, current affairs, sports & entertainment: 876-630-1210. WHATSAPP 876-285-5693

Subscribe on YouTube: Nationwide90FM",68119,,322,112514799,"6 Bradley Avenue, Kingston",Nationwide90FM,34268
1124125037265674240,Fri May 03 01:34:28 +0000 2019,,"<a href=""https://www.hootsuite.com"" rel=""nofollow"">Hootsuite Inc.</a>","Kingston Wharves 2018 Performance Signaled The Success Of Their Growth Strategy, Recording Revenues Of J$7.25 Billi… https://t.co/MfN9I4nKgL",,,False,1,0,0,Tue Jun 16 23:48:40 +0000 2009,"https://t.co/HAMJ8YwPer @ Twitter for The Latest In Caribbean & International SME Business News, Empowering Leaders and Entrepreneurs. Follow, Stay Current",534,,101,47779740,Silicon Mountain Mandeville Ja,Businessuiteonline.com,5939
1122749992287047682,Mon Apr 29 06:30:32 +0000 2019,,"<a href=""http://twitter.com/download/iphone"" rel=""nofollow"">Twitter for iPhone</a>",@Nick_kwl ja aber andererseits wäre er sonst zu stark,,,False,0,0,1,Sun Jul 02 09:20:12 +0000 2017,,5,,57,881442369161310208,,Philipp,242
1112850556446339073,Mon Apr 01 22:53:43 +0000 2019,,"<a href=""https://social.zoho.com"" rel=""nofollow"">Zoho Social</a>","The following ABMs will be out of service for approx. 2hrs on April 2.

&gt;Atrium - 8am; alternative NCB New Kingston… https://t.co/ehn3tQXjtj",,,False,3,0,0,Wed Jan 28 11:54:04 +0000 2009,"Welcome to NCB Jamaica's Twitter page, your source for NCB updates & customer service assistance. We're available Mon- Sat: 7:00am - 9:00pm.

IG: ncbjamaica",27525,,1539,19647756,Jamaica,NCB Jamaica,26456
1111309477754470400,Thu Mar 28 16:50:01 +0000 2019,,"<a href=""https://about.twitter.com/products/tweetdeck"" rel=""nofollow"">TweetDeck</a>",Also on our esteemed panel is Mr. Jeffrey Hall of Jamaica.  He serves as Chair of the Scotia Group Jamaica (&amp; its s… https://t.co/asUJN20pfC,,,False,0,0,0,Mon Aug 04 15:33:50 +0000 2014,The official Twitter account of the Trinidad & Tobago Chamber of Industry  and Commerce.  The Voice of Business in Trinidad & Tobago!,3604,,385,2706825253,Rep. of Trinidad & Tobago,T&T Chamber,2884
1109686256513007616,Sun Mar 24 05:19:55 +0000 2019,,"<a href=""http://twitter.com/download/android"" rel=""nofollow"">Twitter for Android</a>","@guruintraining_ Another example could be Jetcon and King. Wharves. If Jetcon price goes down, I could short it and… https://t.co/lsW9IYSLWh",,,False,0,0,1,Mon Mar 09 00:17:00 +0000 2015,chairman of patient capital. trying to make a dollar from a few cents. audaces fortuna iuvat.  life appreciates.,612,,824,3068837330,🇯🇲✌🏾,Chad-Anthony Coke,4251
1109430327880105984,Sat Mar 23 12:22:57 +0000 2019,,"<a href=""http://www.jamaicanmateyangroupie.com"" rel=""nofollow"">jamaicanmateyangroupie.com</a>","CUSTOMS WORKER WHOSE NAME WAS ON GUN SHIPMENT HELD - https://t.co/NggmvhrVzR

 Jevaughnie McKay, the man charged in… https://t.co/dT0aYeH5Mw",,,False,1,1,0,Tue Sep 29 20:41:46 +0000 2009,Not an ordinary website,1764,,696,78410802,,Jamaicangroupiemet,39493
1109107220019462144,Fri Mar 22 14:59:02 +0000 2019,,"<a href=""https://dlvrit.com/"" rel=""nofollow"">dlvr.it</a>","Man charged for massive gun, ammo seizure at Kingston Wharves remanded https://t.co/7H6NOyjIcv",,,False,1,0,0,Wed May 20 15:24:08 +0000 2009,"RJR (Radio Jamaica) News from Kingston, Jamaica",78644,,2,41379524,Jamaica,The News from RJR,45293
1108539751831867392,Thu Mar 21 01:24:07 +0000 2019,,"<a href=""http://twitter.com/download/iphone"" rel=""nofollow"">Twitter for iPhone</a>",So did Ruel Reid’s daughter graduate from CMU last November and now in a managerial position at Kingston wharves ? @kamlanichkole,,,False,0,0,0,Thu Oct 18 04:09:31 +0000 2012,One who has eaten the fruit and tasted its mysteries. I’m short and ugly please leave me alone.,183,,183,888067338,Jamaica,win,4470
1107057065518866432,Sat Mar 16 23:12:27 +0000 2019,,"<a href=""https://mobile.twitter.com"" rel=""nofollow"">Twitter Web App</a>","#Logistics #JAM - Kingston Wharves to build third warehouse | @JamaicaGleaner
https://t.co/PbjgeKwI8Q",,,False,3,0,0,Thu May 07 14:23:04 +0000 2009,"Official account of Paul Hay, #PHC Projects (@PH_AECo) founder. I tweet on #Politics, #Economy, #Society & #Technology in Jamaica & the Cayman Islands. #JM  #KY",3660,,3552,38439288,"Kingston, Jamaica",Paul A. Hay,227687
1106888537302073344,Sat Mar 16 12:02:46 +0000 2019,,"<a href=""http://twitter.com/download/iphone"" rel=""nofollow"">Twitter for iPhone</a>",Jamaica continues to grow its economy🇯🇲👏 https://t.co/OZpWbbjsJJ,,,False,0,0,0,Mon Jan 24 17:16:59 +0000 2011,Etiquette & Social Skills trainer. Lead trainer with the Minister of Education in Jamaica training students studying hospitality. A lover of afternoon tea.,81,,69,242383477,Jamaica,Jennifer Coleen Speid,2032
1106530654899130370,Fri Mar 15 12:20:41 +0000 2019,,"<a href=""http://www.facebook.com/twitter"" rel=""nofollow"">Facebook</a>",Kingston Wharves to build third warehouse https://t.co/F4AO9iLOHL,,,False,0,0,0,Wed May 08 18:36:54 +0000 2013,Leveraging the Power of Speed and Connectivity. A government-backed initiative to establish Jamaica as a global logistics node within the Americas.,1059,,801,1413560323,Jamaica,Jalogisticshub,4371
1106521582640476161,Fri Mar 15 11:44:38 +0000 2019,"{'attributes': {}, 'bounding_box': {'coordinates': [[[-78.368878, 17.705786], [-78.368878, 18.525029], [-76.183028, 18.525029], [-76.183028, 17.705786]]], 'type': 'Polygon'}, 'country': 'Jamaica', 'country_code': 'JM', 'full_name': 'Jamaica', 'id': 'd66ca907ceb62690', 'name': 'Jamaica', 'place_type': 'country', 'url': 'https://api.twitter.com/1.1/geo/id/d66ca907ceb62690.json'}","<a href=""http://twitter.com/download/iphone"" rel=""nofollow"">Twitter for iPhone</a>",Kingston Wharves to build third warehouse https://t.co/msWOoHjRDy via @jamaicagleaner,,,False,0,0,0,Sun Apr 19 18:40:59 +0000 2009,,2079,,129,33275038,"ÜT: 18.003908,-76.784123",Graham Jervis 🇯🇲,176540
1106471633680764929,Fri Mar 15 08:26:09 +0000 2019,,"<a href=""https://ifttt.com"" rel=""nofollow"">IFTTT</a>",Kingston Wharves to build third warehouse https://t.co/8Zz7KtKM7Q,,,False,0,0,0,Thu Feb 21 14:04:36 +0000 2019,"#PetroMLogistics, a division of @PetroMCorp. is a
4PL | Customs Agency and Specialized Logistics Operator in Mexico, USA, UAE, India & China. 🚛🚆✈️⛴️🛰️",736,,74,1098584274276634625,Mexico,PetroM Logistics,24847
1106429141354729472,Fri Mar 15 05:37:18 +0000 2019,,"<a href=""http://jamaica-gleaner.com"" rel=""nofollow"">GleanerViaDrupal</a>",Kingston Wharves to build third warehouse  - https://t.co/vzSiAIsA0n,,,False,4,0,1,Mon May 18 20:04:59 +0000 2009,"Jamaica's most trusted news source for 186 years. Where life unfolds. Follow for news, sports, business, lifestyle, entertainment and commentary.",305590,,602,40954616,Jamaica,Jamaica Gleaner,162209
1105849153488371712,Wed Mar 13 15:12:38 +0000 2019,,"<a href=""http://twitter.com/download/iphone"" rel=""nofollow"">Twitter for iPhone</a>","Nobody:

Police: Container of guns seized at Kingston wharves https://t.co/eaiCDmKhZH",,,True,1,0,0,Tue Jun 30 22:21:13 +0000 2015,,450,,417,3262549638,,Jevaughn,11713
1105786460614156288,Wed Mar 13 11:03:31 +0000 2019,,"<a href=""http://www.facebook.com/twitter"" rel=""nofollow"">Facebook</a>",Braeton man charged in connection with the seizure of 20 illegal firearms at Kingston Wharves..,,,False,0,0,0,Fri Jan 22 00:46:04 +0000 2010,Geniusatworkhere#,74,,182,107259127,,alex barker,8655
1104569419513192448,Sun Mar 10 02:27:26 +0000 2019,,"<a href=""https://mobile.twitter.com"" rel=""nofollow"">Twitter Web App</a>",#Shipping #JAM - ‘The boss of all bosses’ - First woman terminal manager at Kingston Wharves in 74 years |… https://t.co/mLDf8Fqk29,,,False,2,0,0,Thu May 07 14:23:04 +0000 2009,"Official account of Paul Hay, #PHC Projects (@PH_AECo) founder. I tweet on #Politics, #Economy, #Society & #Technology in Jamaica & the Cayman Islands. #JM  #KY",3660,,3552,38439288,"Kingston, Jamaica",Paul A. Hay,227687
1103964791822082053,Fri Mar 08 10:24:51 +0000 2019,,"<a href=""https://proudjamaica.com"" rel=""nofollow"">PROUD JAMAICA</a>",‘The boss of all bosses’  - First woman terminal manager at Kingston Wharves in 74 years - https://t.co/zTZBkQWXsd https://t.co/E4Tqydy42Q,,,False,0,0,0,Tue Sep 01 23:31:15 +0000 2015,PROUDLY HIGHLIGHTING JAMAICA'S MANY ACHIEVEMENTS,1684,,1103,3517353735,Jamaica,PROUD JAMAICA,29231
1103960864434974721,Fri Mar 08 10:09:15 +0000 2019,,"<a href=""http://www.linkedin.com/"" rel=""nofollow"">LinkedIn</a>","Celebrating Women Day:
://https://t.co/uE2nu7gDQW https://t.co/zJDgQkHaF5",,,False,0,0,0,Sun Jul 08 14:09:15 +0000 2018,"SCMPro, FCILT, PMP, MBA",22,,188,1015961010837053440,,Pankaj_OM,507
1103892529496305664,Fri Mar 08 05:37:43 +0000 2019,,"<a href=""https://ifttt.com"" rel=""nofollow"">IFTTT</a>",‘The boss of all bosses’  - First woman terminal manager at Kingston Wharves in 74 years  https://t.co/x61bazJlbN,,,False,0,0,0,Thu Feb 16 22:56:04 +0000 2012,"News, Information, Fashion & Products With A Distinct Island Flavor",2475,,2220,494465960,Worldwide,ISLAND SWAG,105214
1103480178293071872,Thu Mar 07 02:19:10 +0000 2019,,"<a href=""http://twitter.com"" rel=""nofollow"">Twitter Web Client</a>",Sales rep questioned about recent gun find at Kingston Wharves https://t.co/9xGciR7GXd,,,False,0,0,0,Sun Apr 19 18:40:59 +0000 2009,,2079,,129,33275038,"ÜT: 18.003908,-76.784123",Graham Jervis 🇯🇲,176540
1103361197028585474,Wed Mar 06 18:26:23 +0000 2019,,"<a href=""https://www.hootsuite.com"" rel=""nofollow"">Hootsuite Inc.</a>","Sales rep questioned about recent gun find at Kingston Wharves
https://t.co/o44lTVCL8r https://t.co/hoLrp3xNNv",,,False,0,0,0,Mon Apr 14 11:52:10 +0000 2014,Get the real story on Jamaica and the Caribbean from the Region's #1 digital news source. Download the app TODAY! https://loopne.ws/yRXbUZHfh8,41083,,444,2443768622,Jamaica,Loop Jamaica,52186
1100807009962811393,Wed Feb 27 17:16:57 +0000 2019,,"<a href=""http://twitter.com"" rel=""nofollow"">Twitter Web Client</a>","Firearms Intercepted At Kingston Wharves On Tuesday Reportedly Originated In The Bronx, NY | RJR News - Jamaican Ne… https://t.co/MSyxve8EsF",,,False,0,0,0,Sun Apr 19 18:40:59 +0000 2009,,2079,,129,33275038,"ÜT: 18.003908,-76.784123",Graham Jervis 🇯🇲,176540
1100781686948794370,Wed Feb 27 15:36:20 +0000 2019,,"<a href=""http://www.facebook.com/twitter"" rel=""nofollow"">Facebook</a>","A total of 20 illegal firearms were intercepted at the wharf earlier today. Law enforcement officials confirmed, to… https://t.co/DfHJIjJrwa",,,False,0,0,0,Wed Jun 17 05:59:45 +0000 2009,Without the link the chain is never completed.,556,,795,47873142,United States,ochilink,39230
1100781673334087687,Wed Feb 27 15:36:17 +0000 2019,,"<a href=""http://publicize.wp.com/"" rel=""nofollow"">WordPress.com</a>",20 Guns Seized at the Kingston Wharves https://t.co/JD0WaCDHCH https://t.co/RqeQ8n070A,,,False,0,0,0,Wed Jun 17 05:59:45 +0000 2009,Without the link the chain is never completed.,556,,795,47873142,United States,ochilink,39230
1100586284404432896,Wed Feb 27 02:39:52 +0000 2019,,"<a href=""http://publicize.wp.com/"" rel=""nofollow"">WordPress.com</a>","20 More Guns Seized at the Kingston Wharves (Feb 26, 2019) https://t.co/wmvQpbuKMv https://t.co/0qxMeQGIkl",,,False,1,0,0,Fri Jan 20 01:44:14 +0000 2017,Jamaica’s Online Newspaper: News website that readers have access to 24/7 without a subscription or newspaper cost. We get you the news you want...,321,,1592,822258399681380357,Jamaica,Mckoy's News,16442
1100577695375732736,Wed Feb 27 02:05:44 +0000 2019,,"<a href=""http://twitter.com/download/android"" rel=""nofollow"">Twitter for Android</a>","So when we gonna do a probe of kingston wharves and Jamaica Customs?

Also, what's happening with the Petrojam scandal?",,,False,3,0,0,Fri Apr 08 01:27:29 +0000 2011,Dark skin women are beautiful! Women ❤️ LIVERPOOLFC 💕,3858,,1940,278817972,Barbados,stop being straight,148592
1100572163705319429,Wed Feb 27 01:43:46 +0000 2019,,"<a href=""http://publicize.wp.com/"" rel=""nofollow"">WordPress.com</a>",20 more GUNS seized at the Kingston Wharves https://t.co/NyNLAINTHq https://t.co/cbPSQhn2L9,,,False,0,0,0,Fri May 01 19:58:03 +0000 2009,Where you come to know wa gawn aboard and a yard...,106,,371,37025626,Jamaica,Fiwivibe,3756
1100566697654829062,Wed Feb 27 01:22:02 +0000 2019,,"<a href=""http://twitter.com"" rel=""nofollow"">Twitter Web Client</a>","20 more GUN$ seized at the Kingston Wharves (Feb 26, 2019) https://t.co/7czt9ejc4N via @YouTube",,,False,0,0,0,Sun Oct 09 20:10:02 +0000 2016,"A look at Jamaican & Global: Entertainment, Sports, Social, Political, Cultural &Topical issues",341,,194,785210732652601344,Jamaica,Teach Dem,2744
1100560306617679873,Wed Feb 27 00:56:39 +0000 2019,,"<a href=""https://sproutsocial.com"" rel=""nofollow"">Sprout Social</a>","Police have seized 20 firearms and over 790 rounds of ammunition at a terminal at Kingston Wharves.
The Counter-Ter… https://t.co/4dXIKR4MCc",,,False,0,0,0,Sun Jul 07 17:12:43 +0000 2013,"Your digital media company for EVERYTHING about Jamaica, locally or internationally",1107,,26,1575595518,"Ocho Rios, Jamaica ",JamaicaToday.com,26819
1100550120859463680,Wed Feb 27 00:16:10 +0000 2019,,"<a href=""https://www.hootsuite.com"" rel=""nofollow"">Hootsuite Inc.</a>",Cops seize 20 guns during operation at Kingston Wharves https://t.co/CLYTKotWb4 https://t.co/zeuhDOCR8T,,,False,3,0,0,Mon Apr 14 11:52:10 +0000 2014,Get the real story on Jamaica and the Caribbean from the Region's #1 digital news source. Download the app TODAY! https://loopne.ws/yRXbUZHfh8,41083,,444,2443768622,Jamaica,Loop Jamaica,52186
1100530204722765825,Tue Feb 26 22:57:02 +0000 2019,,"<a href=""http://twitter.com/download/android"" rel=""nofollow"">Twitter for Android</a>",@JamaicaConstab says 791 bullets seized at Kingston Wharves along with the 20 guns. https://t.co/z5gxhbDlnC,,,False,13,2,6,Mon Jul 13 09:37:13 +0000 2009,"Multi-award winning Broadcast Journalist. Co-Host of Nationwide: This Morning on @NationwideRadio in Kingston, Jamaica.",33957,,318,56332781,"Kingston, Jamaica",Abka Fitz-Henley,80262
1100514460471566337,Tue Feb 26 21:54:28 +0000 2019,,"<a href=""http://twitter.com/download/android"" rel=""nofollow"">Twitter for Android</a>",#BREAKING: Gun seizure at Kingston Wharves. Sources indicate 20 guns have been found. Among the weapons is 1 sniper… https://t.co/drVs1v3eCV,,,False,0,0,0,Fri Jul 15 15:15:25 +0000 2016,,367,,177,753971236770766852,Jamaica,Krysten-Paige Smith,2064
1100506982463799297,Tue Feb 26 21:24:45 +0000 2019,,"<a href=""http://twitter.com/download/android"" rel=""nofollow"">Twitter for Android</a>","UPDATE: 20 guns and hundreds of rounds of ammunition found at the Kingston Wharves today.

Among the seizure - 6 ri… https://t.co/Iy5ajPVEQD",,,False,82,35,17,Mon Jul 13 09:37:13 +0000 2009,"Multi-award winning Broadcast Journalist. Co-Host of Nationwide: This Morning on @NationwideRadio in Kingston, Jamaica.",33957,,318,56332781,"Kingston, Jamaica",Abka Fitz-Henley,80262
1100500436149305344,Tue Feb 26 20:58:44 +0000 2019,,"<a href=""http://twitter.com/download/iphone"" rel=""nofollow"">Twitter for iPhone</a>",#BREAKING: Gun seizure at Kingston Wharves. Sources indicate 20 guns have been found. Among the weapons is 1 sniper… https://t.co/Zndv70muAA,,,False,21,6,2,Tue Feb 19 18:58:01 +0000 2019,Journalist | Young Journalist of the Year Nominee (2019) | Prime Minister’s Youth Award Nominee (2019) | Honourary Doctor | “The rest is still unwritten.”,1307,,747,1097933339296780289,Jamaica,William Mitchell,2968
1097160314871840768,Sun Feb 17 15:46:17 +0000 2019,,"<a href=""http://www.facebook.com/twitter"" rel=""nofollow"">Facebook</a>",Man arrested as CTOC clamps down on 'scam' at Kingston Wharves https://t.co/KzMIMmkMII,,,False,0,0,0,Fri Jan 22 00:46:04 +0000 2010,Geniusatworkhere#,74,,182,107259127,,alex barker,8655
1096788822732488705,Sat Feb 16 15:10:07 +0000 2019,,"<a href=""https://www.hootsuite.com"" rel=""nofollow"">Hootsuite Inc.</a>","Man arrested as CTOC clamps down on 'scam' at Kingston Wharves
://ow.ly/XF7p30nIWDY https://t.co/zkGIxNtgxp",,,False,3,1,1,Mon Apr 14 11:52:10 +0000 2014,Get the real story on Jamaica and the Caribbean from the Region's #1 digital news source. Download the app TODAY! https://loopne.ws/yRXbUZHfh8,41083,,444,2443768622,Jamaica,Loop Jamaica,52186
1096150337524781056,Thu Feb 14 20:53:00 +0000 2019,,"<a href=""http://twitter.com"" rel=""nofollow"">Twitter Web Client</a>","In and around Kingston Wharves, Jamaica's main multi-purpose terminal. Photo impressions. https://t.co/fmp5xgOTev https://t.co/3aBBX1wEXw",,,False,1,0,0,Sun Feb 10 14:16:47 +0000 2013,Working on the Chicken and the Egg:  Trade Logistics and Development #transport #shipping #maritime #trade #tradefacilitation #connectivity,2578,,1565,1166039702,Geneva,Jan Hoffmann,5778
1095690275022929920,Wed Feb 13 14:24:53 +0000 2019,,"<a href=""http://twitter.com"" rel=""nofollow"">Twitter Web Client</a>","Photo Flashback: February 1975
The 23,300 ton Saguenay Chartered vessel, the m/v Bella Coola on its inaugural voyag… https://t.co/XM4UbeGpGT",,,False,1,0,0,Tue Dec 29 12:44:28 +0000 2015,"Jamaica's record keeper. Inside the 185-year-old archives of @jamaicagleaner, the oldest operating newspaper in the Caribbean. 
876-932-6231",2384,,242,4643160922,Jamaica,GLNR Archives,4889
1095365053237391360,Tue Feb 12 16:52:34 +0000 2019,,"<a href=""http://twitter.com"" rel=""nofollow"">Twitter Web Client</a>",Kingston Wharves Limited and the Caribbean Maritime University have partnered to advance research and development o… https://t.co/mAArLiBvcw,,,False,5,0,0,Fri Jun 17 18:59:17 +0000 2011,"Join the official page for the Jamaica Information Service, #1 source for information and Government of Jamaica news. JIS - The Voice of Jamaica.",57409,,401,319212589,Jamaica,JIS News,34253
1094368894733742081,Sat Feb 09 22:54:11 +0000 2019,,"<a href=""http://www.facebook.com/twitter"" rel=""nofollow"">Facebook</a>",Kingston Wharves and CMU Partner to Advance Port and Logistics Sector - Jamaica Information Service https://t.co/de5sdtGLbe,,,False,0,0,0,Tue Mar 08 14:23:52 +0000 2011,"The official page of the Ministry of Education, Youth and Information (MOEYI) 

Hon Fayval Williams MP, Minister

Hon Robert Nesta Morgan, MP, Minister of State",10544,,57,262668111,Jamaica,MOEYI Jamaica🇯🇲,7102
1094222657728462849,Sat Feb 09 13:13:05 +0000 2019,,"<a href=""http://www.facebook.com/twitter"" rel=""nofollow"">Facebook</a>",Kingston Wharves and CMU Partner to Advance Port and Logistics Sector - Jamaica Information Service https://t.co/d2pkhjaTKp,,,False,0,0,0,Wed May 08 18:36:54 +0000 2013,Leveraging the Power of Speed and Connectivity. A government-backed initiative to establish Jamaica as a global logistics node within the Americas.,1059,,801,1413560323,Jamaica,Jalogisticshub,4371
1094154143776661504,Sat Feb 09 08:40:50 +0000 2019,,"<a href=""https://www.fiweh.com"" rel=""nofollow"">FiWEH Life</a>",Kingston Wharves and CMU Partner to Advance Port and Logistics Sector - FiWEH Life - https://t.co/JBs7VSRb5b,,,False,0,0,0,Thu Jul 23 00:09:15 +0000 2009,"FiWEH life provides breaking news, entertainment, music, videos, fashion, politics and culture Infotainment for the Caribbean diaspora worldwide.",1061,,357,59299156,Worldwide,FiWEH Life,886043
1094012458002460673,Fri Feb 08 23:17:50 +0000 2019,,"<a href=""http://publicize.wp.com/"" rel=""nofollow"">WordPress.com</a>",Kingston Wharves and CMU Partner to Advance Port and Logistics Sector https://t.co/Z9kP9l3Tpq https://t.co/ovE3Rqko1u,,,False,0,0,0,Fri Jan 20 01:44:14 +0000 2017,Jamaica’s Online Newspaper: News website that readers have access to 24/7 without a subscription or newspaper cost. We get you the news you want...,321,,1592,822258399681380357,Jamaica,Mckoy's News,16442
1093966105301999622,Fri Feb 08 20:13:39 +0000 2019,,"<a href=""https://www.hootsuite.com"" rel=""nofollow"">Hootsuite Inc.</a>",Kingston Wharves and CMU Partner to Advance Port and Logistics Sector. #JISNews https://t.co/2lVzX5nNCQ https://t.co/p3KZz7ltDw,,,False,0,0,0,Fri Jun 17 18:59:17 +0000 2011,"Join the official page for the Jamaica Information Service, #1 source for information and Government of Jamaica news. JIS - The Voice of Jamaica.",57409,,401,319212589,Jamaica,JIS News,34253
1093964040563556353,Fri Feb 08 20:05:26 +0000 2019,,"<a href=""https://ifttt.com"" rel=""nofollow"">IFTTT</a>",Kingston Wharves and CMU Partner to Advance Port and Logistics Sector https://t.co/VXMXrouoJx,,,False,0,0,0,Thu Aug 20 16:54:48 +0000 2015,"CASE DISMISSED! - A non-patronising, non-sentimental & non-pathological account of a Jamaican migrant mother living, surviving & raising six children in London.",610,,3119,3432960957,"London, England",Gloria Cameron,20344
1093238427984777224,Wed Feb 06 20:02:07 +0000 2019,,"<a href=""http://twitter.com/download/iphone"" rel=""nofollow"">Twitter for iPhone</a>",“I want to thank the Kingston Wharves Limited for the support they’ve given to the Caribbean Maritime University an… https://t.co/E7FKCy2HmM,,,False,3,0,0,Sat Nov 07 12:20:58 +0000 2015,"Official Twitter for Caribbean Maritime University.
The Maritime University of Choice for Global Leaders",1030,,261,4157035639,"Palisadoes, Kingston JM",Caribbean Maritime University,1218
1093234775526174721,Wed Feb 06 19:47:36 +0000 2019,,"<a href=""http://twitter.com/download/iphone"" rel=""nofollow"">Twitter for iPhone</a>","“This latest partnership among the CMU, Kingston Wharves &amp; @MOEYIJamaica is a major step towards achieving greater… https://t.co/J7yi6oTNH5",,,False,2,0,0,Sat Nov 07 12:20:58 +0000 2015,"Official Twitter for Caribbean Maritime University.
The Maritime University of Choice for Global Leaders",1030,,261,4157035639,"Palisadoes, Kingston JM",Caribbean Maritime University,1218
1093232586434985985,Wed Feb 06 19:38:54 +0000 2019,,"<a href=""http://twitter.com/download/iphone"" rel=""nofollow"">Twitter for iPhone</a>","“The logistics industry is pivotal to the overall growth of Jamaica. This investment in the Academic Chair at CMU,… https://t.co/58NMcjLL5L",,,False,2,0,0,Sat Nov 07 12:20:58 +0000 2015,"Official Twitter for Caribbean Maritime University.
The Maritime University of Choice for Global Leaders",1030,,261,4157035639,"Palisadoes, Kingston JM",Caribbean Maritime University,1218
1093230592643219457,Wed Feb 06 19:30:59 +0000 2019,,"<a href=""http://twitter.com/download/iphone"" rel=""nofollow"">Twitter for iPhone</a>",Happening Now: The launch of a Professorial Chair in Logistics and Port Management at the Kingston Wharves Limited. https://t.co/ZVcjgbBCJ2,,,False,1,1,0,Sat Nov 07 12:20:58 +0000 2015,"Official Twitter for Caribbean Maritime University.
The Maritime University of Choice for Global Leaders",1030,,261,4157035639,"Palisadoes, Kingston JM",Caribbean Maritime University,1218
